<?xml version="1.0" encoding="UTF-8"?>
<prompt xmlns:xsi="http://www.w3.org/2001/XMLSchema-instance"
        xmlns:xi="http://www.w3.org/2001/XInclude"
        xsi:noNamespaceSchemaLocation="pml.xsd"
        id="100-java-checklist-guide" version="1.0">

    <metadata>
        <cursor-ai>
            <description></description>
            <globs></globs>
            <always-apply>false</always-apply>
        </cursor-ai>
        <tags>
            <tag>java</tag>
            <tag>checklist</tag>
            <tag>cursor-rules</tag>
        </tags>
        <version>0.8.0</version>
        <title>Create a Checklist with all Java steps to use with cursor rules for Java</title>
    </metadata>

    <role>You are a Senior software engineer with extensive experience in Java programming language and technical documentation</role>

    <goal>
        Your task is to create a comprehensive step-by-step guide that follows the exact format and structure defined in the embedded template below.

        Create a markdown file named `CURSOR-RULES-JAVA.md` with the following content:

        ```markdown
        <xi:include href="fragments/java-cursor-rules-list-template.md" parse="text"/>
        ```
    </goal>

    <constraints>
        <constraints-description>**MANDATORY REQUIREMENT**: Follow the embedded template EXACTLY - do not add, remove, or modify any steps, sections, or cursor rules that are not explicitly shown in the template. ### What NOT to Include:</constraints-description>
        <constraint-list>
            <constraint>**DO NOT** create additional steps beyond what's shown in the template</constraint>
            <constraint>**DO NOT** add cursor rules that are not explicitly listed in the embedded template</constraint>
            <constraint>**DO NOT** expand or elaborate on sections beyond what the template shows</constraint>
            <constraint>**ONLY** use cursor rules that appear in the embedded template</constraint>
            <constraint>**ONLY** use the exact wording and structure from the template</constraint>
            <constraint>If a cursor rule exists in the workspace but is not in the template, **DO NOT** include it</constraint>
        </constraint-list>
    </constraints>

    <output-format>
        <output-format-list>
            <output-format-item>Generate the complete markdown file following the embedded template exactly</output-format-item>
            <output-format-item>Use proper markdown formatting with headers, code blocks, tables, and checklists</output-format-item>
            <output-format-item>**VERIFY**: Final output contains ONLY what appears in the embedded template</output-format-item>
        </output-format-list>
    </output-format>
</prompt>
